{
  "receipt_id":"tr-001",
  "protocol":"trigger/0.1",
  "proposal_id":"research-001",
  "decision":"approve",
  "actor":"human:researcher",
  "authority":"experiment-approval",
  "action":"run_experiment",
  "scope":"lab:A",
  "constraints":{"max_cost":50000},
  "policy_version":"lab-policy/3",
  "issued_at":"2026-01-01T09:00:00Z",
  "expires_at":"2026-01-01T17:00:00Z",
  "nonce":"demo-001"
}